Country,Publishing organisations,Organisation size,Results,Category,Project title,Cover letter,Description of your portfolio,Project link 1,Project link 2,Project link 3,Project link 4,Project link 5,Project link 6,Project link 7,,,,,,,,,,,
United States,MIT Technology Review,Small,Participant,Young journalist,Karen Hao," Growing up, I didn't know I wanted to be a journalist. There wasn't a single one in my Chinese-American community. Instead, I wanted to be a writer because I was obsessed with reading fiction. In high school, I discarded these dreams under the pressure of applying to colleges that could lead to a stable career. So I found my new love: engineering, and headed to MIT.   In 2015, I graduated with a degree in mechanical engineering, and settled in at a comfortable tech job in Silicon Valley. But my nagging desire to write came back to haunt me as I grew increasingly disenchanted by what I saw around me. The engineers of the tech world were rewiring the rules of society without really engaging with and understanding society itself. A year after I started, I left to become a journalist, determined to find a platform for examining and exposing this reality and its consequences.   This is what drew me back to my alma mater to become the <a href=""https://www.technologyreview.com/profile/karen-hao/"">artificial intelligence reporter</a> at MIT Technology Review in October 2018. The expansiveness and influence of AI across industries, domains, and aspects of people's lives provided a perfect way for me to do this kind of examination. I quickly developed my coverage around a driving thesis: technology people (e.g.: researchers and engineers) and humanities people (e.g. lawyers, policymakers, and social scientists) need to talk more to one another. With my background, I can offer them a common language. I can unbox the complicated technical concepts for nontechnical people to understand, as well as demonstrate how the details and decisions made in the process of technology development directly translate to impact on the ground.   As a visual and kinesthetic learner, I also believe there's more to communication than words. So I am constantly seeking novel ways to utilize my <a href=""https://www.karendhao.com/viz"">visualization, data analysis, and coding skills</a> to help me storytell more clearly and powerfully along the way.   My voice and these approaches have resonated with my readers. In less than year, the weekly AI newsletter I write for Tech Review, tripled its readership (reaching close to 100,000) and earned me a nomination for best newsletter on the internet in the 2018 Webby Awards. My articles are also referenced in nonprofit, government, and intergovernmental reports and have become assigned reading in many university classrooms, including policy classes at Harvard Kennedy School, law classes at Duke University, and technology ethics classes at Stanford University.   On top of that, I have become the <a href=""https://www.karendhao.com/speaking"">go-to speaker</a> about AI and society on podcasts, radio programs, and stages around the world. Last year, I gave an opening keynote at the Marketing Artificial Intelligence Conference, moderated a panel for the UN Foundation with former US CTO Megan Smith, and chaired the AI and education track at the Middle East's premiere AI conference in Dubai, just to name a few highlights. In February of this year, I will also take the stage at TEDxGateway, India's largest ideas festival, in front of an audience of 6,000.   Acknowledging the authoritativeness, influence, and quality of my work, Tech Review fast-tracked my promotion in January to senior artificial intelligence reporter.   I believe, too, that these factors qualify me to be considered for this award. I am less than halfway through my fourth year as a journalist, and I still have so much farther to go. I am determined to continue telling provocative stories that force technology builders and regulators alike to confront its impact on society. And I am committed to preparing them with a common language to do something about it. "," I am submitting two samples as part of my data and visual portfolio. I describe them both below.    Can you make AI fairer than a judge? Play our courtroom algorithm game   This is an interactive narrative that shows why decision-making algorithms can’t be completely fair when operating on data from an unfair world. It visualizes real data used by a criminal justice algorithm to predict whether a defendant will be re-arrested. It then challenges readers to adjust the algorithm to make those predictions fairer. But after every adjustment, a new notion of fairness is revealed showing that the outcomes still aren't fair. This build up leads to the punchline: these notions, in practice, can never be satisfied all at once.   I wanted to do this story to illustrate the complexity of algorithmic discrimination—one of the most important debates currently happening at the intersection of AI and society. To technologists, I wanted to make the point that AI bias is not just a theoretical math problem. To solve it requires grappling with social and historical factors. Data points aren't just numbers; they're actually people. To social scientists and policymakers, I wanted to create a tool that helps them think through the nuances of impact and regulation. While the story used criminal justice as a case study, decision-making algorithms are used across different contexts, including in hiring, healthcare, and lending. It's also timely because the <a href=""https://www.technologyreview.com/s/613310/congress-wants-to-protect-you-from-biased-algorithms-deepfakes-and-other-bad-ai/"">US Congress</a> is currently in the middle of trying to tackle this problem.   I wrote, coded, and designed the visualizations for this story with a collaborator. We conducted every interview, wrote every line of code, and workshopped every sentence together. I principally drove the narrative flow and drafted the original story with the idea of an interactive build up. I also did most of the production coordination becase my collaborator was remote and not part of the publication.   To date, the story has received over 80,000 page views, with an average read time of 2:20 minutes. It has been publicly commended by leading experts and institutions like <a href=""https://twitter.com/AINowInstitute/status/1184887683472154624"">AI Now</a>, <a href=""https://twitter.com/azeem/status/1184809241187618817"">Azeem Azhar</a>, <a href=""https://twitter.com/JanelleCShane/status/1184877632027951104"">Janelle Shane</a>, and <a href=""https://twitter.com/marylgray/status/1184803065926275073"">Mary Gray</a>. It has also been featured on <a href=""https://radio.wosu.org/post/tech-tuesday-ai-criminal-justice#stream/0"">radio</a> and <a href=""https://www.experian.com/blogs/news/datatalk/ai-judges-court/"">podcasts</a> and become assigned reading in university courses, including at <a href=""https://web.stanford.edu/class/cs182/"">Stanford University</a>.        We analyzed 16,625 papers to figure out where AI is headed next   This story presents a data-driven, visual, and narrative history of the field of artificial intelligence. I scraped the largest open database of AI research papers and analyzed the evolving language in the abstracts, then visualized the most salient trends in a series of charts.   I wanted to show the transformation of the field over its nearly 60 year existence to make the technology less mysterious to lay readers who may be approaching the subject for the very first time. Seeing how AI was created helps elucidate why it looks as it does today, and clarify how far its capabilities are from any true intelligence. It also illustrates the fact that it has always been the creation of humans, born from and shaped by a rich debate of ideas. In this way, it makes AI (and its decisions) feel more tangible than magical, more work-in-progress than perfect, and more contestable than final.   To date, the story has received 131,000 page views, with an average read time of 2 minutes. It was also shared widely on social media, with over 1,000 unique tweets from both by <a href=""https://twitter.com/zittrain/statuses/1088806727435329538"">AI experts</a> and <a href=""https://twitter.com/i/web/status/1092063294297382912"">lay readers</a>. I also published the majority of the code on Github and the <a href=""https://github.com/karenhao/techreview_arxiv_scrape"">repo</a> was starred 38 times and forked four. ",https://www.technologyreview.com/s/613508/ai-fairer-than-judge-criminal-risk-assessment-algorithm/,https://www.technologyreview.com/s/612768/we-analyzed-16625-papers-to-figure-out-where-ai-is-headed-next/,,,,,,,,,,,,,,,,
South Africa,News24,Big,Participant,Young journalist,Victor Mkhetsane - Social Media Coordinator,"I am Victor Mkhetsane, Social Media Coordinator at News24 the biggest Online News Publication in the continent of Africa. I came with a Film and Television degree into the world of journalism and completely submerged myself into it all. My job specs mostly included social content publishing of all news articles as soon as they are published, yet I took everything further by developing engagement producing mechanisms that will be helpful in terms of aligning the social media audience that we cater for and the best way to give them stories. News24 deals with issues that I have always been passionate about. My 9-year Social Media experience has seen me be a user too meaning . I know what stories people deserve to see on social media and how best to curate them as soon as they are published. Especially on Facebook where users never have data to click on a particular link that was shared and read more on that particular story. I always find ways to cater for such audiences. What I enjoy the most about what I do, is giving those individuals a chance for them to see these stories on such platforms to make sure that even if they don't have enough data to read, they can at least engage with the post. My multimedia skills have also been helpful in terms of creating cool graphics to use on social media. Especially when I have to illustrate a message on a story with a picture. Being a journalist and learning all of this in the real world has been an eye awakening for me because I get to see all the current affairs stuff as they happen in the real world. One of the hardest moments was working throughout Uyinene Mrwetyana's stories and the Gender Based Violence marches that took places after that. Dealing with stories where women were being killed, reading all the graphic stories and trying to package and process them for social media, while taking every response that is coming through was challenging for me. This is mostly because I was never trained into handling the hardcore, graphic and intense moments of journalism during my undergrad, I am learning everything as it happens in the real world and expected to still deliver no matter how triggering it is. Having to keep emotions in check or better yet, switch them off was one of the things I had to do in order to survive that period. I knew that it was not the end, there may be times where fun and lighthearted current affairs moments are going to come. Way harder and emotionally mind whirling stories are also going to come in the future, however learning and preparing for those days now, is a good start. The thing is, I entered the Journalism field mid 2019 where I was only supposed to come and handle the Social Media pages in the absence of the individual who was on a maternity leave. My contract was expired end of October, however I was called in to come and Freelance during festive season in the similar position. During that period, the same position I filled in for was opened as the team was looking at expanding the team and then I applied for it, luckily I got it. Hence, I am now in this space forever. This position keeps me learning and experiencing something new on a daily basis and receiving this recognition means that my seniors and editors made a good call and saw that I habe the potential to grow and be one of the","                                                            My Portfolio URL: <a href=""http://portfolio.victormkhetsane.com"">http://portfolio.victormkhetsane.com</a>    I happen to have a portfolio of a Social Media person for a news publication, hence some people call me a  Social Media Journalist  for News24. This is quite unusual as not a lot of people do have them but then I figured that it would be a good representation of all the work that I have done in journalism up to so far, it will also serve as a hub that houses my achievements in journalism and some of the testimonials from prominent individuals plus the projects that I have been involved in.   The <a href=""https://portfolio.victormkhetsane.com"">front page</a> gives a brief description of me as an individual, while also noting the more intrinsic parts of my job which is being  Social Content Publisher  and an Engagement Producer. At the bottom, it enables you to go straight to my resume where you will get a detailed curriculum vitae that points out everything that I have done in any of the positions I held in the past, the media skills that I possess and also a pdf version if anyone is keen on downloading the traditional version. It also houses a brief note of the institution of high learning that I attended.   My <a href=""https://portfolio.victormkhetsane.com/?page_id=152"">bio</a> answers the  “tell me about yourself”  question but mostly reads like how I would be explaining my journey in journalism. I had to highlight only the important parts like my experience in Social media with how I got introduced to digital content creation. This then points you into how I got to join Media24 and found myself in journalism plus the multiple brands that I happened to coordinate in my role. Another thing that it includes is my motion picture skills where it highlights two of the most unique projects that I worked in as an undergraduate and then closes off with my graduation and where journey is currently as a journalism enthusiast.   My <a href=""https://portfolio.victormkhetsane.com/?page_id=153"">Portfolio</a> tab, which is a bigger and pivotal part has list of all projects that I deemed important which I worked on. Clicking on a singular project, like an example “<a href=""https://victormkhetsane.com/index.php/news24-festive-season-tabled-work/""> News24 – Social Media Freelancing </a>”. That takes you to a page from a main site that shows few things that I did during my freelancing period. It also highlights the highest performing social media post that I created during that period but also has some of the ideas that I worked around including a brief social media stat reported as compiled by the Deputy Site Editor. Another tab is the <a href=""https://victormkhetsane.com/index.php/news24-social-media-coordinator/""> News24 – Social Media Coordinator </a> which was compiled when I was on a temporary position. It has icons of every platform I was curating the social media content for, and when you click on each of them, they take you to a pdf page of the compiled report. Other projects listed are a documentary I worked on, a short insert that show cased garments made for plus size girls, including a short film.   For now it is dressed up as it is, however the main site is still under construction and set to live on 1<sup>st</sup> April and that will be a bigger detailed background of me. ",https://drive.google.com/file/d/1d1khYMaDzThZYMZPcN2mZmm69RYQoYFd/view?usp=sharing,https://www.news24.com/World/News/commander-in-chief-resign-resign-iranians-demand-khamenei-to-step-down-over-plane-shooting-20200112,https://drive.google.com/file/d/1T5gEnGAO_X4VqMDUW1LeiTH9nI38tsnO/view?usp=sharing,https://victormkhetsane.com/index.php/news24-festive-season-tabled-work/,https://victormkhetsane.com/index.php/marvel-protege-youtube-channel/,https://www.facebook.com/news24/posts/10158123923481842,https://victormkhetsane.com/index.php/social-media-influencer-documentary/,,,,,,,,,,,
Kyrgyzstan,"RFE/RL Kyrgyz Service, Internews Kyrgyzstan",Big,Participant,Young journalist,Suiumkan Ulanbek kyzy,"  I started practicing data journalism as a journalist through Data Journalism Fellowship by      Internews Kyrgyzstan where I was accepted while being a student of a journalism major at the American University of Central Asia. I learned data journalism after taking two semester long data journalism class from the professor Anastasia Valeeva who came to Kyrgyzstan in order to develop this sphere of journalism. Later on she became my data journalism mentor and inspired me to do data projects.  I practice data journalism for two years and this amount of time is quite short to fully discover the sphere. I still have left a lot to learn in order to strengthen my skills and techniques and also I often make mistakes in the process of making a data project. However, I am one of the first data journalists in my country, and overall in Central Asian region and I am proud that I will be one of the figures started practicing this genre of journalism in my country. I aim to inspire and train other journalists to practice data journalism in the future. This is, in my opinion, the first reason why I should be considered for this award. Most of my works target social problems such as poverty, child labour and women’s rights, etc. I see data journalism alongside with the solutions journalism since it indicated the problems - when problems are discovered - it is easier to find solutions.      I get my inspiration from different sources - they might be professional data journalists whose work I admire, or sometimes people sharing with their experience can play as a motivation for me to make a project. An article “The Last Person You’d Expect to die in Childbirth” by ProPublica’s Nina Martin about preventable maternal deaths inspired me to write more about women and the problems they are facing. I wrote an article about women who get infected with HIV by their sexual partners and I think with the article I could raise awareness about women and HIV. I understand for myself that raising an awareness in any of my work is my professional priority - if my work is able to change minds even of one person, I will know that I am doing my work not in vain. That is another reason why I should be considered for this award - as a rising young journalist, I want to fight stereotypes and disinformation that harm people themselves  and I am sure I can do it with the help of data journalism.   ","  “I was not protected because I completely trusted him”. Why women in Kyrgyzstan started to get infected with HIV more and more” focuses on women who mostly got infected by their sexual partners and did not know their partners HIV status. I used the UNICEF publications on condom usage by women and mostly women were not using it during the sexual intercourse. An article got about 3000 views.      In the article “More than half of the students in the regions do not study well. What does housework have to do with it?”, I wanted to prove the argument that most of the children from the remote areas cannot get into higher educational institutions not because they are not talented, but they were not given a chance because of the work amount that they were responsible for. The challenge for the article was getting the data. Most of the times data is in PDF publications and they need to be transformed into excel format that allows us analyze the data.       ",https://docs.google.com/document/d/16aCsSmCD9Y76r9nuLUN0O8SwwZ4bbHd71ZZX4uoMefc/edit?usp=sharing,https://docs.google.com/document/d/1jpY8paDTyPM53tgAfOPnumJCBH4NF8Itbc1oUdjwpTc/edit?usp=sharing,https://docs.google.com/document/d/17-EUU0yrCQBGJKAd8wbplwHly6FBISEaUKooj_ARuUg/edit?usp=sharing,,,,,,,,,,,,,,,
