Indonesia,Narasi,Small,,,Narasi,"We are submitting this portfolio on behalf of our newsroom, a small, independent investigative outlet based in Indonesia that focuses on producing data-driven, visually engaging investigative journalism designed for young audiences across social media platforms.  Founded with the belief that investigative journalism must evolve to meet younger, digital-first audiences, our team combines traditional field reporting with advanced data collection and innovative analytical methods, making complex issues like disinformation, environmental destruction, and political influence accessible through short-form video, interactive visuals, and creative social media storytelling.  We have been active in investigative journalism and visual storytelling for over 7 years, but our transformation into a data-driven newsroom accelerated in the past 5 years, driven by the urgent need to expose corporate and political wrongdoing tied to environmental and human rights issues.  We are particularly inspired by international leaders in investigative data journalism, such as ProPublica, ICIJ, OCCRP etc, who show how collaboration, data science, and bold storytelling can create real impact. Locally, we have also been mentored and supported by senior investigative journalists in Indonesia’s Alliance of Independent Journalists (AJI) and collaborated with data experts at institutions like Monash Data Futures Institute and Greenpeace Indonesia, helping us build the technical capacity to carry out ambitious, data-heavy investigations.  We are proud of our evolution from a small, scrappy team producing short documentaries into a newsroom capable of fusing investigative rigor with creative visual storytelling — and making complex data work accessible and understandable to millions of young Indonesians.  We hope this portfolio demonstrates the potential for innovation and impact from small, independent investigative teams, and we are honored to be considered for this award.","Our newsroom presents this data-driven investigative portfolio, showcasing how a small, video-based newsroom in Southeast Asia can innovate and produce impactful investigations despite limited resources, legal risks, and restricted data access. In 2023-2024, we combined big data processing, AI tools, spatial analysis, and creative storytelling to investigate disinformation campaigns, environmental destruction, and political hypocrisy.  Project 1: Tracking the Digital Hate Campaign Against Rohingya Refugees  This project uncovered how organized digital hate campaigns fueled disinformation against Rohingya refugees in Indonesia, escalating into real-world violence. Using custom web crawlers, social media scraping, bot detection algorithms, and sentiment analysis, we processed over 1.08 million data points from TikTok, Facebook, Instagram, and Twitter/X. Combining this with political network analysis and field reporting in Aceh, the investigation exposed a coordinated disinformation ecosystem, driven by bot farms, influencers, and political actors. The work became a reference for civil society groups monitoring online hate.  Project 2: Presidential Campaign Jet Tracking and Carbon Footprint Analysis  This project tracked the private jet usage of Indonesia’s presidential candidates, calculating their carbon emissions and linking their luxury flights to sponsors with ties to corruptors and mining oligarchs. Using real-time flight tracking, ownership tracing, and cross-referencing flight IDs with corporate records, we revealed how candidates’ environmental promises contradicted their private air travel practices. The findings — including one candidate’s chartered flights emitting the equivalent CO2 of 58,000 trees’ absorption capacity — triggered public conversations on environmental hypocrisy in Indonesian politics.  Project 3: Nickel Downstreaming’s Environmental and Social Cost in Weda Bay  In collaboration with Greenpeace Indonesia and Khairun University, this project combined scientific water testing, 20 years of satellite imagery analysis, and spatial mapping to document how nickel mining in Central Halmahera polluted rivers, triggered deforestation, and displaced local communities. Using Mapbiomas, Nusantara Atlas, QGIS, and Google MyMaps, we mapped 230,796 hectares of nickel concessions and traced severe flood risks linked to deforestation. The work merged scientific data, human-centered stories, and visual analysis, making it both accessible to youth and impactful for policymakers.  Regards method and techniques, Our disinformation investigation used time-based clustering, and heatmap visualizations to identify bot networks amplifying anti-Rohingya hate speech across platforms.  In Weda Bay, we combined 20 years of satellite imagery analysis with water quality testing to link deforestation, pollution, and flooding directly to Indonesia’s nickel mining boom.  Collectively, the three key investigations in this portfolio — Rohingya digital hate campaigns, presidential campaign carbon footprints, and nickel-driven environmental damage in Weda Bay — reached over 8 million views across TikTok, Instagram, YouTube, and other platforms.  The Rohingya investigation was cited by fact-checking organizations and civil society groups, becoming part of a broader push for platform accountability regarding hate speech and refugee protection. The presidential jet tracking project triggered national conversations around green hypocrisy, elite privilege, and corporate-political collusion, especially regarding campaign funding from mining oligarchs.  The Weda Bay investigation contributed directly to local advocacy campaigns, community resistance efforts, and legal challenges against environmentally destructive mining operations, while also informing global discourse on the hidden costs of Indonesia’s nickel downstreaming program.","English, Bahasa",https://www.youtube.com/watch?v=p7-IFOGYxmU,https://www.youtube.com/watch?v=sAcec94RRow,https://www.youtube.com/watch?v=rg698JD-F5Y,,,,,
Russian Federation,Mediazona,Small,,,Mediazona,"For over 10 years now, Mediazona has been covering political repression, police violence, torture, forced labor in prison, and the many injustices we’ve personally endured. Since the start of the full-scale invasion in Ukraine, covering the war, military losses, and war crimes has also become our key objective. Russian authorities do everything to conceal information about the war and dissent: they don’t reveal the losses numbers, hide political cases deep inside the court system, prosecute those who dare to speak out. But our data team is constantly working on breaching this wall of secrecy. By harvesting open, but chaotic and elusive official data, by compiling it into workable databases and efficient monitoring tools, we are trying to stay ahead of the state machine of repression and propaganda.  Since 2020, when Mediazona’s data team emerged, we’ve released dozens of exclusive investigations, research, and interactive features. This work was quoted by prominent international media (e.g., The New York Times, The Associated Press, The Economist, The Wall Street Journal) and won prestigious journalistic awards, including the European Press Prize. Although we constantly collaborate with other media outlets (see our “Price of Bakhmut” submission), the work we are presenting in this portfolio was done by our journalists alone. Due to safety reasons and military censorship in Russia, we cannot disclose the names of all members of our data team. Please, contact us if this portfolio will be mentioned, so we could provide you with information on how to credit the authors in a safe and appropriate manner.","This portfolio showcases the investigative journalism of Mediazona’s data team, focusing on three long-term projects that have significantly contributed to public understanding—both in Russia and globally—political repression and the Ukraine war’s toll on Russia. **Monitoring Russia’s wanted list.** Russia’s Interior Ministry maintains a publicly accessible but cumbersome online wanted list. Searching for names requires a full name and year of birth, plus solving a CAPTCHA—and a 5-minute cooldown before another try. Given the scale of political repression, this has become a daily concern for many, an everyday necessity. Mediazona’s data team had been monitoring the list for years, but in [February 2024](https://en.zona.media/article/2024/02/13/wanted-trl), we automated the process, downloading the entire database (by solving CAPTCHAs algorithmically) and creating a user-friendly, searchable copy on our website. This revealed dozens of cases of political persecution by Russian law enforcement. Since its release, the list has been updated twice (in [May](https://en.zona.media/article/2024/05/15/wanted-may-trl) and in [November](https://en.zona.media/article/2024/11/26/wanted-trl?p=1&t=all&s=statusAll&q=)), with continued planned updates for 2025. With nearly 300,000 website views and millions reached via social media, 20% of users were English speakers. Major international media have [cited](https://apnews.com/article/russia-estonia-kallas-wanted-list-4ca301df09eace6643be66a9a4a93fe8) our data on foreigners wanted by Russia. **Monitoring Russia’s court system.** For years, we’ve been monitoring Russia’s court system, particularly cases related to political charges such as “terrorism” and “fake news about the army.” The database we compiled, containing over 100 million court records spanning a decade, is constantly being updated. This dataset has enabled us to publish hundreds of news articles and in-depth investigations into state repression. Key investigations include the [Baimak protests](https://zona.media/article/2024/07/11/76) (sadly, only available in Russian), where 76 Bashkortostan residents faced charges for protesting the conviction of an environmental activist, and “Fine after fine”, which exposed how the state pushes [“foreign agents”](https://en.zona.media/article/2024/05/17/foreign-agents-trl) (anti-Putin activists and journalists) towards criminal prosecution. By combining real-time monitoring with archival research, we’ve been able to reveal both individual cases of repression and broader oppressive patterns. Another major topic within the court database is [AWOL](https://en.zona.media/article/2024/04/12/record-trl) cases in the Russian army, which spiked in 2024. **Monitoring losses of the Russian military in the war with Ukraine.** Russian authorities are hiding the death toll of the Ukraine war. Mediazona, in collaboration with BBC News Russian and volunteers, [tracks Russian losses](https://en.zona.media/article/2022/05/20/casualties_eng-trl) in Ukraine using open-source data. Over three years, we’ve verified almost 100 thousand names. The database aids reporting, like when a small fine arts museum had its collection published online. We [discovered](https://en.zona.media/article/2024/08/13/artsalsk-trl) 41 paintings of men who died in the war, and by cross-referencing them with our database (which contained over 60,000 names at the time), we were able to identify five previously unknown KIA soldiers. **The last article in the portfolio**, “[Cover me](https://en.zona.media/article/2024/06/06/blankets-trl),” has a unique background. By analyzing data from the Russian Post, we uncovered how a military initiative allowing civilians to send packages to soldiers went terribly wrong. A single medical lieutenant became a recipient of 180 tonnes of old blankets and warm items from across Russia. Despite appeals to stop, donations continued; what became of the blankets and where they are now remains unclear.","English, Russian",https://en.zona.media/article/2024/02/13/wanted-trl,https://en.zona.media/article/2024/11/26/wanted-trl,https://en.zona.media/article/2024/06/06/blankets-trl,https://en.zona.media/article/2024/08/13/artsalsk-trl,https://zona.media/article/2024/07/11/76,https://en.zona.media/article/2024/04/12/record-trl,https://en.zona.media/article/2024/05/17/foreign-agents-trl,
United States of America,"The Examination was the originator of all the stories in the portfolio. We partnered with various outlets for each story, including The Houston Chronicle, LaBot, Salud Con Lupa, AL. com, The Milwaukee Journal Sentinel, PennLive, the Lancet, Initium Media, The Washington Post,  Columbia Journalism Investigations, The Post and Courier, RTBF and Africa Uncensored.",Big,,,The Examination,"The Examination launched in September of 2023 as an independent nonprofit newsroom that investigates preventable health threats and empowers people in harm’s way.   In 2024, our first full year of existence, with a team of eight reporters, we uncovered a myriad  of health risks across the globe. We published more than a dozen investigations with partners in 18 countries. Here is some of what our work exposed: How tobacco companies successfully lobbied government officials in Kenya to downplay warning labels on nicotine pouches. How oil companies and regulators in Texas ignored dangerous gas leaks that sicken residents. And how the food and beverage industries have co-opted registered dietitians to promote sugary products and spread an “anti-diet” message online, to name a few.  Our work led to real world change. Examination stories have resulted in not only raising awareness but also regulatory action from places as far as the Republic of Congo to here in the U.S. where the Federal Trade Commission sent warning letters to social media influencers in the wake of our stories.   We sent reporters to where the problems are. For our story on flavored “click” cigarettes, reporter Maria Perez traveled to Chile to interview dozens of young people about what started them smoking cigarettes. Their answers were resoundingly the same: hooked by the fruity watermelon, orange and other candy-like flavors. Partnering with a small Chilean news outlet, LaBot, Perez exposed how British American Tobacco and Philip Morris International introduced more than 20 new flavored brands of conventional cigarettes across Latin America - after promises to move toward a smoke-free world.   Our ambition is to produce the highest-quality journalism that informs public discourse, inspires positive change and leads to a healthier world. We believe we hit the mark in 2024.","The Examination launched in September of 2023 as an independent nonprofit newsroom that investigates preventable health threats and empowers people in harm’s way.   In 2024, our first full year of existence, with a team of eight reporters, we uncovered a myriad  of health risks across the globe. We published more than a dozen investigations with partners in 18 countries. Here is some of what our work exposed: How tobacco companies successfully lobbied government officials in Kenya to downplay warning labels on nicotine pouches. How oil companies and regulators in Texas ignored dangerous gas leaks that sicken residents. And how the food and beverage industries have co-opted registered dietitians to promote sugary and other unhealthy products and spread an “anti-diet” message online, to name a few.  Our work led to real world change. Examination stories have resulted in not only raising awareness but also regulatory action from places as far as the Republic of Congo to here in the U.S. where the Federal Trade Commission sent warning letters to social media influencers in the wake of our stories.   We sent reporters to where the problems are. For our story on flavored “click” cigarettes, reporter Maria Perez traveled to Chile to interview dozens of young people about what started them smoking cigarettes. Their answers were resoundingly the same: hooked by the fruity watermelon, orange and other candy-like flavors. Partnering with a small Chilean news outlet, LaBot, combing through company documents, public and others records, Perez exposed how British American Tobacco and Philip Morris International introduced more than 20 new flavored brands of conventional cigarettes across Latin America - after promises to move toward a smoke-free world.   We worked with local partners to expose wrongs affecting their readers.To tackle the story on the leaky gas tanks sickening resident in Texas, we partnered with the Houston Chronicle and for the first time mapped the wells with potentially deadly levels of hydrogen sulfide. Our interactive map allowed residents to punch in their address and see their risk. We also bought and put an H2S monitor outside a neighbor’s home and learned levels of the toxic gas had soared past state limits dozens of times.   Our ambition is to produce the highest-quality journalism that informs public discourse, inspires positive change and leads to a healthier world. We believe we hit the mark in 2024.","English, Spanish, Chinese",https://www.theexamination.org/articles/oil-companies-leak-toxic-gas-across-texas-making-local-residents-sick,https://www.theexamination.org/articles/in-the-us-opioid-maker-purdue-is-bankrupt-its-global-counterparts-make-millions,https://www.theexamination.org/articles/as-obesity-rises-big-food-and-dietitians-push-anti-diet-advice,https://www.theexamination.org/articles/fruity-click-cigarettes-a-hit-with-latin-american-teens-amid-constant-industry-lobbying,https://www.theexamination.org/articles/bat-lobbying-kenya-nicotine-pouches,https://www.theexamination.org/articles/delta-8-hemp-sales-soar-poison-control-center-calls,https://www.theexamination.org/articles/big-tobacco-was-forced-to-stop-marketing-low-tar-cigarettes-in-china-sales-are-booming,https://www.theexamination.org/articles/forever-chemical-polluters-land-hefty-contracts-to-meet-electric-vehicle-battery-demand
Argentina,Chequeado,Small,,,Suite de tecnología cívica con impacto social,"Desde Chequeado, presentamos nuestra suite de tecnología cívica con impacto social, un conjunto de herramientas diseñadas para empoderar a la ciudadanía en la lucha contra la desinformación y fortalecer el acceso a información verificada.  Hacer accesibles datos complejos y brindar transparencia a la comunidad, con ayuda de la tecnología, es un aporte para elevar la calidad del debate público y contribuir al fortalecimiento de la democracia. En un contexto donde la desinformación circula cada vez más rápido, desarrollamos soluciones innovadoras que fomentan el pensamiento crítico y permiten a las comunidades involucrarse activamente en la verificación de información.  Nuestra suite incluye El Chequeador, que guía a los ciudadanos en el fact-checking; El Explorador, un chat con IA que ofrece información verificada; El Chatbot, que facilita la consulta y verificación de contenido sospechoso vía WhatsApp; y El Desgrabador, que transcribe videos de YouTube, agilizando el análisis periodístico.  Miles de personas confían en Chequeado para verificar información antes de compartirla. En ese instante, en la decisión de chequear antes de difundir, radica el impacto real de nuestro trabajo.  Además, nuestra experiencia muestra que la clave no está solo en la tecnología, sino en diseñarla con una mirada cívica y de servicio público.   Nos impulsa el  deber cívico de continuar desarrollando y actualizando herramientas que ayuden a nuestra comunidad. Apostamos por la transparencia y la colaboración: a través de inteligencia artificial, machine learning y recuperación de información, facilitamos el acceso a datos confiables y promovemos la alfabetización digital. Además, compartimos nuestras herramientas con otras organizaciones y medios, convencidos de que la lucha contra la desinformación debe ser colectiva.  Postulamos este portafolio con la convicción de que la tecnología cívica es clave para una ciudadanía informada y crítica. Seguiremos creando soluciones abiertas, accesibles y eficientes para fortalecer la democracia.  Dolores Pujol (Directora de Innovación - Chequeado).","A través de nuestra suite de tecnología cívica con impacto social, ofrecemos herramientas innovadoras para empoderar a la ciudadanía en la lucha contra la desinformación. Esta iniciativa incluye cuatro desarrollos tecnológicos: El Chequeador, que guía en el proceso de fact-checking; El Explorador, un chat con IA que responde con información verificada; El Chatbot, que permite verificar contenido sospechoso vía WhatsApp; y El Desgrabador, que transcribe el audio de videos de YouTube.  Nuestra suite ha impactado a miles de personas, facilitando el acceso a información verificada y promoviendo el pensamiento crítico. Solo en 2024, nuestro Chatbot recibió 10 mil consultas, permitiendo a la ciudadanía verificar contenido en tiempo real. El Explorador ha acercado notas periodísticas a quienes buscan profundizar en ciertos temas. El Chequeador es utilizado por periodistas y educadores para mejorar sus prácticas de verificación, mientras que El Desgrabador ha optimizado el trabajo de profesionales y estudiantes, reduciendo tiempos de transcripción y mejorando el análisis periodístico. En 2024, El Desgrabador fue la página más visitada de nuestro sitio, con 1.9 millones de vistas y 660.000 usuarios activos.  Con esta propuesta, buscamos dotar a la comunidad de herramientas que ayuden a detectar y contrarrestar la desinformación, fortalecer la democracia y elevar la calidad del debate público. No solo las usamos en nuestro trabajo, sino que también las compartimos con medios y organizaciones, convencidos de que la lucha contra la desinformación debe ser colectiva.  En 2024, enfrentamos desafíos como la creciente sofisticación de la desinformación impulsada por IA generativa y la desconfianza en medios e instituciones. Apostamos por la innovación tecnológica para ofrecer herramientas accesibles que permitan a la comunidad verificar información de manera sencilla y eficiente.  Logramos soluciones como El Explorador, que integra IA para facilitar el acceso a información verificada, y El Chatbot, que usa WhatsApp para ampliar el alcance de nuestros chequeos. También enfrentamos retos en el acceso a datos y la generación de contenido comprensible para distintos públicos, trabajando día a día en mejorar nuestras herramientas.  Cada desarrollo tiene un propósito clave: El Chequeador sistematiza la verificación, permitiendo que más profesionales se sumen a esta práctica; El Explorador demuestra el uso responsable de la IA para acercar información verificada; El Chatbot resalta la importancia de llegar a la audiencia en sus espacios digitales cotidianos, y El Desgrabador optimiza el trabajo periodístico a través de la automatización.  Desarrollamos nuestra suite con metodología SCRUM, complementada con investigación de usuarios y prototipado iterativo para asegurar soluciones centradas en necesidades reales. Construimos una arquitectura robusta con Python y Django para el backend y React (JavaScript) para las interfaces, integrando diseño UI/UX para una mejor experiencia de usuario.  Para potenciar estos servicios, aplicamos inteligencia artificial en distintas formas: Whisper para transcripción automática, machine learning para detectar frases chequeables, sistemas RAG (Retrieval-Augmented Generation) para extraer contenido de fuentes confiables y modelos como GPT-4o y Claude para procesamiento avanzado de lenguaje.",Español,https://chequeado.com/chequeador,https://chequeado.com/el-explorador,https://chequeado.com/desgrabador,https://chequeado.com/whatsapp,https://chequeado.com/,,,
