Nigeria,PREMIUM TIMES,Big,Participant,Young journalist,Yusuf Akinpelu," Akinpelu Yusuf   Akinpeluyusuph@gmail.com   Enugu Court, Gaduwa Estate   Abuja, Nigeria   (+234) 9032788612       January 10, 2020       Marianne Bouchart,   Competition Manager,   marianne@sigmaawards.org       Hello,   RE: 2020 Sigma Awards   From childhood, before I knew I was Yusuf Akinpelu, becoming a renowned journalist was all I ever dreamed. So, passion for the profession has never been missing in my toolbox. This has helped me develop strong storytelling ability and solid news judgment.       I began as a campus journalist in the University of Ibadan, where I majored  in Statistics but made more waves in journalism than I did in class. I graduated as the Best Campus Journalists — one of the fifteen awards I won as a student journalist.       But before graduation, without any formal training, I was among the first few names that popularized fact-checking among Nigerians. I was chosen as an external contributor for Dubawa, Nigeria's  foremost online fact-checking platform. And upon graduation, I was immediately hired.       The prospects I showed enticed me to Nigeria's only Pulitzer Winning Newspaper, Premium Times, under which Dubawa is. I was immediately transferred to the parent company, where I now cover Nigeria's National Assembly, arguably one of the most important beats covered by the company.       So barely three months into the job, not only have I written nearly over a hundred stories, each of my reports have been layered with depth, in terms of angling, delivery, presentation and even multimedia. For my creativity and critical thinking, my editors have entrusted me with stories which even staffers of the company hardly could have pursued.       In my current internship with Premium Times, as interns, we are not under any duress to deliver certain numbers of stories per week. But because my eyes for story ideas is so eagle-like I see beyond this limitation. Today I have averaged one story per day, weekend and holidays inclusive.       My drive has been to tell human angle stories which are hardly told. This is why, this year, upon the advice of my mentor, Musikilu Mojeed, PREMIUM TIMES' Editor-in-Chief, I devoted so much energy in analysing Nigeria's budget. I focused mainly on how the nation's intended spending would affect the common man.       In the course of my analysis, I was able to show that the nation's budget was stuffed with barrage of fraudulent, frivolous and untraceable projects. By juxtaposing these projects with the reality of the people, I also unveiled where the funds for such money would have better been spent. This got the public aware and even some federal lawmakers themselves faulting the budgeting process they oversaw.       This notwithstanding, as a young journalist, I have  also devoted my craft to the untold stories on education. For instance, one of my latest piece borders on the reward system for best graduating students in Nigeria relative to institutions around the world. My findings show that the academic excellence in Nigeria is less rewarded. The piece brought a new perspective to the discourse of education in the country: that apart from the less attention paid to funding education, the system's best brains are left frustrated even after defiling all odds.   Also, I co-run with a friend a satire blog (punocracy.com), Nigeria's first strictly satire blog. Last year we organized the first ever Satire Writing Contest in Nigeria, if not in Africa, where we declared November 9 as World Satire Day.   Sincerely yours   Yusuf Akinpelu "," My story explored the potentials Nigeri's 2020 budget has for the citizens. Before passage, I pored the budget to spot possible overpriced items in the document. I discovered, in just 22 budget lines, over 1.2 billion naira was inflated into the budget items.   I followed this, upon passage, with the kinds of capital projects billed for this fiscal year. I dug deep in ascertaining what these projects translate to the Nigerian people.    Many of the projects, as I showed throughout my analytical pieces, are misplaced priorities. I was able to deconstruct the barrier of understanding numbers which the nation's federal lawmakers hid behind to sidestep Nigerians with little understanding of figures.   In my projects, I revealed the fraudulent, frivolous and untraceable projects which federal lawmakers stuffed into the budget and how this means bad for Nigerians.   For instance, one which is perhaps the height of it all is the plan to spend N37 billion in renovating the nation's legislative building while the renovation of all federal roads in the country would get N36 billion. This is a country with very indecent stretch of road networks.   I examined the over 1000-page document, to extrapolate meanings out of it. Apart from this, I was also concerned about knowing what kinds of projects the Nigerian government intend building that they seek a whopping $30 billion foreign loan. My resolve paid as I would later show that offsetting infrastructural deficit which the government said it intends to use the loan for was not so.   Bringing this dimension of analysis to the table opened the eyes of many readers to the twist in the whole matter. It, in fact, further got the condemnation of some lawmakers whom ordinarily were part of the process that produced the document (See my interview to one of them https://www.premiumtimesng.com/news/headlines/370876-interview-₦37-billion-for-nass-renovation-wasteful-needless-nigerian-lawmaker.html).   Making meaning of figures is daunting but my background in statistics gave an edge. My goal was to help readers know what they need to know without ambiguity or budgetary jargon. This I did quite well in every of the projects submitted here.   Achieving this, I knew, is not just about writing in a crispy way. I knew I had to do more. So this is why I used as many illustrations as possible using analogies my readers can relate with more. Also, with the use of tables, charts and infographics, I delivered the message with tact and poise. Hard work, meticulousness and patience made this so.   I'm hoping the jury would consider this for the award.   The popularity of the stories in terms of shares and likes on social media also is a key parameter I hope the jury would consider. This means many people saw, read and most likely understand the budget better than they ordinarily would not have had they not read it. The impact this makes is that because readers know more, they are able to ask the right questions as well. ",https://www.premiumtimesng.com/news/headlines/368724-while-buhari-approves-n37-billion-for-nass-renovation-nigerias-roads-repairs-get-less.html,https://www.premiumtimesng.com/news/top-news/359718-fact-check-was-nigerias-per-capita-income-twice-that-of-chinas.html,https://www.premiumtimesng.com/news/headlines/368471-exclusive-beware-buhari-2020-budget-passed-by-nassembly-contains-%e2%82%a6264-billion-fraudulent-projects.html,https://www.premiumtimesng.com/news/headlines/369976-how-2020-budget-signed-by-buhari-was-padded-with-n264-billion.html,https://www.premiumtimesng.com/news/headlines/359274-nigeria-needs-700000-homes-yearly-but-govt-plans-to-build-only-2383.html,https://www.premiumtimesng.com/news/headlines/361826-shocking-ways-nigerian-universities-reward-best-graduating-students.html,https://www.premiumtimesng.com/news/headlines/360803-2020-budget-nigeria-may-lose-₦1-2-billion-next-year-to-overpricing-by-mdas.html,,,,,,,,,,,
United Kingdom,"The Times, The Sunday Times",Big,Participant,Young journalist,George Greenwood,"De I originally considered a career as a commentator, or a reporter within the political lobby in Westminster, when I commenced City Journalism School in 2015. I had discovered my love of journalistic writing the previous year during Masters at the London School of Economics interviewing politicians public figures for the features section at the unfortunately named ""Beaver"" student paper. I was excited by the possibility of being a voice of authority, and to try and effect change, and I had imagined that being in the lobby involved carefully managing confidential sources to leak information they shouldn't in the public interest on a regular basis. However, as I continued my studies, and after reading the excellent memiors of Times political editor Phillip Webster, I was a little dissapointed to find so much of political journalism is dictated by the diary, and that much of what political journalists write is briefed at lobby lunches. When writing columns, I found myself questioning why my voice mattered. Should I not show what is wrong, not just tell, I thought. These revelations conviced me to seek out a much more aggressive form of journalism to focus my efforts. At City Journalism, I discovered, and fell in love with the Freedom of Information Act 2000 as a tool of accountabity. journalism. Early successes using the act to highlight hypocracy and wrongdoing, showing falling numbers of Black military officers and the poor education prospects who those who left social care conviced me this was the right direction of travel, and early specialiation allowed me the chance to continue this work at the BBC. My first reporting job nder the expert tutilage of Martin Rosenbaum, The BBC's FOIA expert and one of the first that saw the potential of the act for journalists. The next stage of my career took place at BBC London, where I hoped to develop my investigative abilities further, working on their online, and then investigations desk. Here, I expanded my repetiore, adding more use of open data, secret filming and video investigations. However, one thing I felt I was lacking was coding ability, and was frustrated at things such as not being able to merge spreadsheets of open data to find stories. It felt like a key skill was missing, so I did something about that, and took the Centre for Investigative Journalism course in R in 2018, working to improve from this base With these newfound coding skills, I was able to be taken on by Leila Haddou to work on the Times and Sunday Times Data Team. Here, I further drove my brand of accountability journalism, mixing FOIA, analysis and matching of open data, leak analysis and good old digging through public records, to delivering five front page investigations to the news desk, including exposing previously unknown links to Russia among legislators, showing how a struggling private mental health care had been offshoring cash to Belieze, showed the Enivironment Agency had failed to properly hold water companies to account for pollution with prosections fallin tenforld, showed the large financial reserves of military charities, and revelaed the failures of Formation House to propely in my first Panama-Papers style international leak investigation with the OOCRP. For this work, I was shortlisted for young journalist of the year at the British Journalism Awards, and named by Forbes as one of the 30 media professions under 30 to watch in Europe. In future, I hope to continue with this kind of work, building on my skill sets, sources, and relations with other reporters and media organisations to continue to deliver my brand of investigative","I originally considered a career as a commentator, or a reporter within the political lobby in Westminster, when I commenced City Journalism School in 2015. I had discovered my love of journalistic writing the previous year during Masters at the London School of Economics interviewing politicians public figures for the features section at the unfortunately named ""Beaver"" student paper. I was excited by the possibility of being a voice of authority, and to try and effect change, and I had imagined that being in the lobby involved carefully managing confidential sources to leak information they shouldn't in the public interest on a regular basis. However, as I continued my studies, and after reading the excellent memiors of Times political editor Phillip Webster, I was a little dissapointed to find so much of political journalism is dictated by the diary, and that much of what political journalists write is briefed at lobby lunches. When writing columns, I found myself questioning why my voice mattered. Should I not show what is wrong, not just tell, I thought. These revelations conviced me to seek out a much more aggressive form of journalism to focus my efforts. At City Journalism, I discovered, and fell in love with the Freedom of Information Act 2000 as a tool of accountabity. journalism. Early successes using the act to highlight hypocracy and wrongdoing, showing falling numbers of Black military officers and the poor education prospects who those who left social care conviced me this was the right direction of travel, and early specialistion in t allowed me the chance to specialise on this form of journalism at the BBC, under the expert tutilage of Martin Rosenbaum, The BBC's FOIA expert and one of the first that saw the potential of the act for journalists. The next stage of my career took place at BBC London, where I hoped to develop my investigative abilities further, working on their online, and then investigations desk. Here, I expanded my repetiore, adding more use of open data, secret filming and video investigations. However, one thing I felt I was lacking was coding ability, and was frustrated at things such as not being able to merge spreadsheets of open data to find stories. It felt like a key skill was missing, so I did something about that, and took the Centre for Investigative Journalism course in R in 2018, working to improve from this base With these newfound coding skills, I was able to be taken on by Leila Haddou to work on the Times and Sunday Times Data Team. Here, I further drove my brand of accountability journalism, mixing FOIA, analysis and matching of open data, leak analysis and good old digging through public records, to delivering five front page investigations to the news desk, including exposing previously unknown links to Russia among legislators, showing how a struggling private mental health care had been offshoring cash to Belieze, showed the Enivironment Agency had failed to properly hold water companies to account for pollution with prosections fallin tenforld, showed the large financial reserves of military charities, and revelaed the failures of Formation House to propely in my first Panama-Papers style international leak investigation with the OOCRP. For this work, I was shortlisted for young journalist of the year at the British Journalism Awards, and named by Forbes as one of the 30 media professions under 30 to watch in Europe. In future, I hope to continue with this kind of work, building on my skill sets, sources, and relations with other reporters and media organisations to continue to deliver my brand of investigative",https://www.thetimes.co.uk/article/global-web-of-firms-for-fraudsters-created-by-british-company-formations-house-5sb8zb238,https://www.thetimes.co.uk/article/formations-house-watchdogs-told-investors-to-be-wary-of-dodgy-deals-bqcdxxw6g,https://www.thetimes.co.uk/edition/news/firms-linked-to-innovate-uk-chiefs-win-millions-in-taxpayer-grants-58qt5mg27,https://www.thetimes.co.uk/edition/news/lost-notes-and-illegible-records-risking-lives-of-nhs-patients-z5sq9bt8v,https://www.thetimes.co.uk/edition/news/dams-in-danger-of-flooding-as-dozens-in-need-of-safety-work-lctsknk3r,https://www.thetimes.co.uk/article/river-pollution-toothless-watchdog-lets-water-giants-set-own-fines-x6z8vml3z,https://www.thetimes.co.uk/article/scots-nhs-board-spent-thousands-on-fax-machines-and-moving-patient-records-by-taxi-2ntmpl52q,,,,,,,,,,,
Lebanon,"Arij, Raseef22, Al-Mayadeen website",Big,Participant,Young journalist,Saja Mortada," Dear all,    I am just a young journalist, who is trying to learn and improve my skills in ""Data journalism"" in a country where its universities don't teach data journalism and its media companies don't care about it or even try to invest in it.    I am trying to spread this important kind of journalism in my country. I succeed in convincing the website where i work to have a ""data journalism"" section and I always try to help my colleagues in this field.    I am working on myself to become one day a ""data journalism"" specialist, because i truly believe in the importance of this field especially in the Arab world, where the authorities always try to hide information and to prevent journalists from doing their job.    even if I don't win this award, I wish at least you will like and appreciate my job and my effort    Thank you "," Saja Mortada (26 years old), is a Lebanese journalist with a master's degrees in Media from ""Antonine"" University in Lebanon and the ""University of Toulon"" in France. She is currently an editor at the media network Al-Mayadeen. Having trained with ""ARIJ"", Saja carried out two investigative reports on human rights issues in her country, published in collaboration with both ARIJ and  Raseef22 . She previously worked with  Black and White for Media Production  and the newspaper,  Assafir . In recent years, Saja has developed her skills in new media, data journalism, mobile journalism and digital storytelling. ",https://arij.net/motherhood_denied/,https://bit.ly/2TnOIZE,https://bit.ly/2Rj1sy9,https://bit.ly/2TnOLoi,https://bit.ly/3ad1sII,https://www.youtube.com/watch?v=L8xt84yrPpI&feature=emb_title,,,,,,,,,,,,
Rwanda,Voice of America,Big,Participant,Young journalist,Young Albino Woman in Rwanda Gains Fame With Music Video Appearance by Eugene UWIMANA," My names are Eugene UWIMANA, I am 25 years old. I will be turning 26 in June 2020.  I was born in a remote village in Western Rwanda. In a poor family. As an orphan of the genocide perpetrated against the Tutsi, to afford to study was a hustle that my guiding parents managed to overcome. From the first day of my educational background languages were my preferred programs. In my country, the School of Journalism and Communication is for the best students of languages from High schools. Good marks were the bridge to my dream ""studying and being a journalist"" in 2014, I got the chance to enter in the school of Journalism at the University of Rwanda.    At University we used to be discouraged by students in upper classes. They used to tell us that we have badly chosen because journalism career doesn't pay in Rwanda. They were right, many media practitioners in my country don't get paid, others get payments on the 90th day or never. For many contracts are just papers. the media owners say the industry is not profitable. However, this has never been an impediment, for me- the boy who wanted to be the voice of voiceless. For the boy who has always lived in poverty-who cannot worry about being poor.    When I was in level two at the University, I wrote ten letters to Managing Directors of different media houses. My favorable Radio station was Radio10. It is the first private radio in Rwanda. That is where I had to start from. I met the managing Director, my request was to be a volunteer in my province- eight hours drive from Kigali, Rwanda's capital city where the station was located. She, the Manager noticed my courage and confidence and gave me the chance. She ordered her subordinate to print a card for me. Wow!!! I am a journalist (who is working for free)   I rushed to the field, yes to do what I like the most. I reported for three months, this time we were on holiday at the University. My hope was to be allowed to keep reporting in my free time when back at school. The surprise was that when I arrived at the station three months later they hired me. in 2015. From this year I held many positions: Reporter, Senior Reporter, Presidential Reporter, Radio Presenter, Tv Presenter, and Chief News Editor. I was blessed a lot to wear those hats when I was still a student. After graduation, I quit the station started to work independently as a Freelance journalist. As a freelance, I had the privilege to work with many big media houses including the Voice of America/English service, Xinhua News Agency, Rwanda Tv and many more. Throughout these past five years, I file many stories that have had very good impacts.    I think I should be considered for this award because I am young and passionate in a country where young journalists are encouraged. The award could be an encouragement for many Journalism students in my country.  Without them, the fourth power cannot be stable.    I look forward to hearing from you,   Yours Sincerely    Eugene UWIMANA     "," The story that I entering this competition has drawn considerable attention and impact here in Rwanda. This is the Intro of the story:     A Rwandan albino woman has appeared in a music video, attracting widespread attention and helping alleviate the stigma of albinos in Africa.  Claudine Mukarusine has described the video as a spark of light in a life filled with discrimination and fear.    I reported this story from the Eastern Province of Rwanda. This is the script:    ( TEXT ))  Claudine Mukarusine is a 28-year-old graduate from the University of Rwanda with Albinism, a genetic condition that makes her hair, skin and eyes pale.       In parts of Africa, Albino body parts are considered to have black magic that brings luck and wealth.  Their graves are dug up and bodies stolen, while the living face constant fear of abduction and murder.        But here in Rwanda, Mukarusine has become famous.        ((SFX:  SOUNDS OF MUSIC VIDEO))       She shows a reporter a music video by Rhythm and Blues singer James Ruhumuriza, known as King James, which she acted in.  The music video, for the song called “Igitekerezo,” meaning “Ideas,” shows King James serenading Mukarusine in the city and countryside.        In Rwanda it has gone viral.       ((MUKARUSINE ACT IN KINYARWANDA))   She says this video played a very big role in her life because many people have come to realize that people with Albinism can do something that is good and appreciated.   (( END ACT ))       The United Nations says nearly 100 albinos were killed in Tanzania alone in the past two decades, including at least 10 children whose bodies were found in January.        For Mukarusine, the song released in January is a spark of light in her dark days of fear that she too could be killed for being albino.       (( MUKARUSINE ACT IN KINYRWANDA))   She says on the first day she heard about this threat, she cried a whole day in class.  She used to cry also in her bedroom, it strongly affected her, says Mukarusine.  She used to worry so much, wondering if she is going to die.  But she couldn’t share her sorrow with anyone, says Mukarusine, and it affected her studies.   (( END ACT ))       R&B singer King James says he composed the song after watching accounts of albinos being killed in Rwanda's neighboring countries.         (( KING JAMES ACT IN ENGLISH))       “That’s when I decided, that I can feature her so that I can give a good message to people that even if they are albinos, they can do anything we can do, anything they want to do.”       (( END ACT ))       Mukarusine works as a mentor at the National Union of Disability Organizations of Rwanda.  She helps three groups of 300 people learn about saving money and accessing finance.       (( MUKARUSINE ACT TWO IN KINYRWANDA))   She has hope and confidence that her future will be good, and she will have a family, says Mukarusine.  She will contribute to developing the lives of people with albinism and other disabilities in general, she says, as well as her family and country.   (( END ACT ))       There are no accurate statistics on the number of albinos in Rwanda.  But Mukarusine hopes her music video fame raises attention to their plight and helps remove some of the stigma and fear for other albinos as it did for her.        ((Eugene Uwimana, for VOA News, Kayonza, Rwanda.))         ",https://www.youtube.com/watch?v=LRad2b1XA_8&t=45s,https://www.youtube.com/watch?v=DeKxXOHmW_0,https://www.youtube.com/watch?v=OyBTq9cPcKs&t=35s,https://www.youtube.com/watch?v=7KZEpBinqaQ&t=44s,https://www.youtube.com/watch?v=fkGs-qJhjiE,https://www.youtube.com/watch?v=c1jYYoHvDOo,,,,,,,,,,,,
