Country,Publishing organisations,Size,Results,Jury's comments,Project title,Cover letter,Description of your portfolio,Language,Link 1,Link 2,Link 3,Link 4,Link 5,Link 6,Link 7,Link 8
Peru,Salud con lupa,Small,Winner,"This portfolio showcases investigations grounded in rigorous data analysis, public information requests, and in-depth field reporting, revealing key facts and amplifying the voices of those affected. Some stories also influenced public policy or incorporated an international benchmarking perspective. Salud con Lupa stands as a leading example of high-quality, meaningful data-driven journalism from a small newsroom in Peru, shedding light on urgent public health issues.",Salud con lupa,"En un contexto donde la desinformación en salud es una amenaza global, Salud con Lupa se ha convertido en un referente del periodismo de datos en América Latina. Su trabajo va más allá de la cobertura de salud tradicional, combinando metodologías rigurosas, acceso a bases de datos y el uso de la ley de transparencia para exponer fallas del Estado, abusos de poder corporativo y amenazas ambientales con impacto directo en la vida de las personas.  Desde su fundación en 2019, ha demostrado el valor del periodismo independiente en tiempos de crisis. Durante la pandemia de COVID-19, no solo informó con precisión a cientos de miles de personas, sino que llenó un vacío en el periodismo de salud en la región, contrastando información con evidencia científica y datos verificables.  Su periodismo ha logrado un impacto tangible. La serie “Un veneno oculto en mi plato” llevó a la creación de proyectos de ley para regular agroquímicos peligrosos en Perú. “Las pastillas y yo”, que expuso los problemas de acceso a medicinas de salud mental y la influencia de la industria farmacéutica en las recetas de los psiquiatras, aceleró la compra de psicofármacos esenciales para los centros de salud mental comunitaria.  Cada una de sus investigaciones se basa en análisis de datos, acceso a información pública y reportería en terreno, garantizando que las historias no solo revelen hechos, sino que también den voz a quienes viven sus consecuencias.  Por su rigurosidad metodológica, impacto en políticas públicas y compromiso con la transparencia, Salud con Lupa ilumina los temas más urgentes en salud pública. En un momento en que la información confiable es vital, su trabajo merece ser reconocido con el Sigma Awards 2025.","Presentamos cuatro investigaciones que cumplen con rigor, análisis de datos profundo y una narrativa visual efectiva.  1. Así aprovecha Syngenta un sistema de licencias indefinidas para vender pesticidas peligrosos Este reportaje revela cómo Syngenta vende en Perú 42 pesticidas prohibidos en la Unión Europea y Suiza gracias a un vacío regulatorio. La investigación utilizó la Ley de Transparencia para obtener datos de registros de agroquímicos, analizó políticas de otros países y expuso los efectos ambientales y de salud de estos químicos. Se destaca por: uso de bases de datos regulatorias para comparar legislaciones internacionales, análisis histórico del sistema de licencias en Perú para explicar cómo se perpetúa la venta de productos prohibidos y visualización de datos sobre importaciones de pesticidas.  2. Martina y las más de 1200 niñas madres que pierden cada año sus proyectos de vida Este reportaje combina análisis estadístico con historias humanas para visibilizar el embarazo infantil en Perú. Se analizaron registros de nacidos vivos del Ministerio de Salud entre 2014 y 2023, identificando un patrón alarmante en seis regiones del país donde la tasa de embarazo en niñas de 10 a 14 años es hasta tres veces mayor que el promedio nacional. El reportaje destaca por uso de bases de datos para mostrar el impacto del problema a lo largo del tiempo y visualización de datos regionales que permite identificar desigualdades geográficas.  3. Sanciones sin efecto y contratos millonarios: la familia Jiménez y su ascenso en Qali Warma Este reportaje expone cómo una red de 23 empresas evadió sanciones y obtuvo S/200 millones en contratos con Qali Warma, el programa de alimentación escolar en Perú. Salud con Lupa cruzó datos de registros de contrataciones públicas, resoluciones judiciales y compras del Estado para demostrar cómo empresas sancionadas por falsificar certificados de calidad lograron seguir contratando con medidas cautelares. Destaca por mapeo de una red de empresas mediante análisis de relaciones familiares y comerciales, uso de visualizaciones para mostrar el crecimiento de contratos irregulares, impacto social directo en la calidad de los alimentos de más de 600 mil estudiantes.  4. Si eres joven, vives en pobreza y abortas, el sistema te persigue hasta condenarte El acceso a 68 sentencias judiciales a través de solicitudes de información pública permitió acercarnos a patrones de criminalización del aborto en Perú. La recopilación y sistematización de datos judiciales revelaron que la mayoría de mujeres sentenciadas eran jóvenes, pobres y de regiones fuera de Lima. Se identificó que 42 de 68 mujeres se autoinculparon, lo que muestra cómo la falta de defensa legal y el hostigamiento judicial influyen en los fallos.   Los trabajos de Salud con Lupa generaron impacto no solo al influir en el debate público, sino también en la toma de decisiones. Por ejemplo, tras la investigación sobre las compras irregulares de alimentos en Qali Warma, el director ejecutivo del programa renunció a su cargo. Asimismo, el reportaje sobre sentencias por autoaborto en Perú motivó capacitaciones a jueces del Poder Judicial para reducir prejuicios en la administración de justicia.",Español,https://saludconlupa.com/noticias/asi-aprovecha-syngenta-un-sistema-de-licencias-indefinidas-para-vender-pesticidas-peligrosos/,https://saludconlupa.com/genero/martina-y-las-mas-de-1200-ninas-madres-que-pierden-cada-ano-sus-proyectos-de-vida/,https://saludconlupa.com/series/qali-warma/sanciones-familia-jimenez-contratos/,https://saludconlupa.com/genero/si-eres-joven-vives-en-pobreza-y-abortas-el-sistema-te-persigue-hasta-condenarte/,https://saludconlupa.com/genero/como-las-fuerzas-antiderechos-capturaron-la-agenda-legislativa-de-la-comision-de-la-mujer-del-congreso/,https://saludconlupa.com/series/el-dinero-o-la-salud/vivir-con-menos-insulina-hasta-que-la-entregue-el-hospital-o-pueda-pagarla/,https://saludconlupa.com/noticias/los-nexos-de-las-asociaciones-de-consumidores-de-vapeadores-con-una-tabacalera/,
West Bank and Gaza,منظمة آخر قصة- last story الإعلامية الفلسطينية المستقلة   www.laststory.net,Small,Winner,"""Last Story"" speaks straight to the heart - and being able to raise awareness is a quality that needs to be valued in Data-Driven Journalism.
More than that, production is well made by a courageous and fighting team, from within one of the most conflict-ridden places on Earth, the Gaza Strip. This ability of speaking from inside the territory - one of the capabilities from conventional journalism - is what breathes life to the productions of ""Last Story"".
The works speak to the local public and also show the world, through the lens of those who knows the reality.
But the materials are not only exciting and made _in loco_, they are technically excelent. Each story is unique, but there's a visual identity that unites them. The attention to aesthetics stands out, coupled with data and reports, a combination that creates very impacting results. ""Last Story"" still has an eye for choosing stories that have particuliarities and show aspects less approached by other media outlets. For all these reasons, ""Last Story"" deserves to be revered.",Last Story,نحن نرى أنا  مشاركتنا تشكل أمر بالغ الأهمية، على الصعيدي المهني، من حيث جودة الأداء الذي نزعم تقديمه على مستوى الصحافة المحلية في قطاع غزة والتي لم يسبقنا إليه أحد من حيث نوعية المعالجة والأسلوب المستخدم في السرد القصصي، رغم تعقيدات الظروف الأمنية القاهرة وتحديات الحرب.   وإلى حد كبير تشكل تغطياتنا كسرا للصورة النمطية التي تهتم بالتركيز على الأخبار بعيدا عن القصة والتي تعبر في جوهرها عن الإنسان وحقوقه المختلفة بخاصة الفئات المهمشة. لذا نعتقد أنه من الضروري أن تتكرم لجنة التحكيم وتأخذ مشاركتنا هذه بعين الاعتبار. فيما يخص مسارنا المهني، فنحن حديثي نشأة إلى حد ما، انطلقنا في ذروة جائحة كورونا 2020 كمبادرة فردية، ثم تحولنا إلى منظمة وحصلنا على التراخيص الرسمية عام 2022. ومنذ النشأة ونحن نتطلع إلى أن تشكل منظمة آخر قصة حاضنة إعلامية للفئات المجتمعية الهشة على المستوى الفلسطيني والإقليمي، حيث تعد شكلاً من أشكال الصحافة المتأنية والجادة والتي تأخذ على عاتقها مساءلة الجهات الحكومية تجاه انتقاص أي من حقوق تلك الفئات، وفي نفس الوقت تقدم جانب توعوي تثقيفي لتلك الفئات تجاه حقوقها. غير أن تدمير مقرنا خلال الحرب أثر بشكل سلبي في مواصلة العمل على نفس الوتيرة حيث شهد عملنا تذبذبا من حين لأخر. لكن بعد إعلان وقف إطلاق النار يواصل فريقنا العمل بجد وبمهنية عالية من أجل مواصلة رسالته. حيث يتنوع الفريق بخبراته وجدارته بإنتاج صحافة العمق.,مرحبا،،  أتقدم إليكم بطلب التقدم إلى الجائزة نيابة عن فريق الصحفيين العاملين في منظمة آخر قصة- last story  خصوصا الفريق المشارك بشكل فاعل في إنتاج صحافة البيانات داخل المنظمة.  نحن نعمل من قطاع غزة كمنظمة إعلامية مستقلة تغطي قضايا الصالح العام والفئات الهشة، بما في ذلك النساء والأطفال وكبار السن والأشخاص ذوي الإعاقة. وفي الحقيقة فإن اندلاع الحرب في غزة كان له بالغ الأثر على عملنا، حيث أنه في الوقت الذي كان من الممكن أن نغطي فيه الكثير من القضايا الهامة التي تخص الشرائح التي نعمل عليها، كنا نواجه تحدي أمني معقد وخطير للغاية في ظل التحديدات الأمنية والعسكرية الميدانية. ومع ذلك ورغم التحديات اللوجستية المتعلقة بفرص الوصول إلى الانترنت بشكل محدود جداً وكذلك الكهرباء، إلا أن فريقنا أثر أن ينتج ما يمكن إنتاجه من المحتوى بما في ذلك صحافة البيانات.  المشاريع التي عملنا عليها طيلة فترة الحرب وإن كانت محدودة لكنها شكلت موضع اهتمام بالنسبة للكثير من وسائل الإعلام والجمهور عموماً على اعتبار أن تبرز المعناة بلغة الأرقام وتقدم لغة تحقيقية في البحث والتقصي وراء القضايا الخفية المتعلقة بالفئات الهشة وتمثلها بالبيانات، وهذا في حقيقة جهد كبير ينطوي على تحدي أكبر في ظل الإمكانات المتاحة. ومع ذلك استطعنا أن نقدم مجموعة من القصص المميزة التي تهتم بالتركيز على مختلف الشرائح المجتمعية المهمشة والتي ازدادت رقعة اتساعها بفعل التداعيات الاقتصادية والصحية التي تسببت بها الحرب. حيث تضاعفت نسب الفقر والبطالة وزادت احتياجات فئات مختلفة أبرزها النساء وكبار السن والأطفال، كما ضاعفت من نسب الإعاقات.  فيما يلي أبرز القصص المدفوعة بالبيانات والتي عمل عليها فريقنا:  •كمائن الطحين: الجوع كسلاح ضد المدنيين •حرب غزة: أثار قاتلة على مرضى الفشل الكلوي •أطفال غزة يواجهون الفقد والعزلة •بلا علاج : مرضى ”الدم” يصارعون الموت •مريضات السرطان بغزة اجتمع عليهن الحرب والمرض •هكذا تأثرت نساء الحرب بالتجويع •الظل الأخير: كبار السن في معركة البقاء •ذوات الإعاقة يواجهن تحدي انعدام الخدمات,Arabic,https://www.laststory.net/post/1113/%D9%83%D9%85%D8%A7%D8%A6%D9%86-%D8%A7%D9%84%D8%B7%D8%AD%D9%8A%D9%86:-%D8%A7%D9%84%D8%AC%D9%88%D8%B9-%D9%83%D8%B3%D9%84%D8%A7%D8%AD-%D8%B6%D8%AF-%D8%A7%D9%84%D9%85%D8%AF%D9%86%D9%8A%D9%8A%D9%86,https://www.laststory.net/post/1116/%D8%AD%D8%B1%D8%A8-%D8%BA%D8%B2%D8%A9:-%D8%A3%D8%AB%D8%A7%D8%B1-%D9%82%D8%A7%D8%AA%D9%84%D8%A9-%D8%B9%D9%84%D9%89-%D9%85%D8%B1%D8%B6%D9%89-%D8%A7%D9%84%D9%81%D8%B4%D9%84-%D8%A7%D9%84%D9%83%D9%84%D9%88%D9%8A,https://www.laststory.net/post/1117/%D8%A3%D8%B7%D9%81%D8%A7%D9%84-%D8%BA%D8%B2%D8%A9-%D9%8A%D9%88%D8%A7%D8%AC%D9%87%D9%88%D9%86-%D8%A7%D9%84%D9%81%D9%82%D8%AF-%D9%88%D8%A7%D9%84%D8%B9%D8%B2%D9%84%D8%A9,https://www.laststory.net/post/1118/%D8%A8%D9%84%D8%A7-%D8%B9%D9%84%D8%A7%D8%AC-:-%D9%85%D8%B1%D8%B6%D9%89-%22%D8%A7%D9%84%D8%AF%D9%85%22-%D9%8A%D8%B5%D8%A7%D8%B1%D8%B9%D9%88%D9%86-%D8%A7%D9%84%D9%85%D9%88%D8%AA,https://www.laststory.net/post/1143/%D9%85%D8%B1%D9%8A%D8%B6%D8%A7%D8%AA-%D8%A7%D9%84%D8%B3%D8%B1%D8%B7%D8%A7%D9%86-%D8%A8%D8%BA%D8%B2%D8%A9-%D8%A7%D8%AC%D8%AA%D9%85%D8%B9-%D8%B9%D9%84%D9%8A%D9%87%D9%86-%D8%A7%D9%84%D8%AD%D8%B1%D8%A8-%D9%88%D8%A7%D9%84%D9%85%D8%B1%D8%B6,https://www.laststory.net/post/1295/%D9%87%D9%83%D8%B0%D8%A7-%D8%AA%D8%A3%D8%AB%D8%B1%D8%AA-%D9%86%D8%B3%D8%A7%D8%A1-%D8%A7%D9%84%D8%AD%D8%B1%D8%A8--%D8%A8%D8%A7%D9%84%D8%AA%D8%AC%D9%88%D9%8A%D8%B9,https://www.laststory.net/post/1311,https://www.laststory.net/post/1314
Hong Kong,South China Morning Post Publishers Ltd,Big,Winner,"The SCMP Graphics Team produced a remarkable series of visual stories; from the hidden lives of domestic helpers to illegal construction mapping and major global events; turning complex public issues into vivid, human-centered narratives.
We were especially impressed by how this work blends creativity, data, and storytelling into a seamless experience. The team's ability to transform complex topics into powerful, beautifully crafted narratives is a perfect example of what great data-driven journalism can achieve.",SCMP Graphics Portfolio,"Comprising nine dedicated individuals, SCMP Graphics crafts impactful visual narratives for readers worldwide. Established in 2011, we’ve consistently developed our approach to infographics and visual storytelling. Though our techniques have adapted, our commitment to providing original and engaging perspectives on current events and timeless cultural, historical, and lifestyle topics remains unchanged.","SCMP Graphics Team: Marcelo Duhalde, Associate Creative Director Kaliz Lee, Assistant Infographic Editor Victor Sanjinez, Senior Infographic Designer Catherine Ma, Infographic Designer Davies Surya, Infographic Designer Rocio Marquez, Senior Infographic Designer YiZhe Ang, Infographic Designer Andrew London, Graphics Editor Dennis Wong, Senior Infographic Designer",English,https://multimedia.scmp.com/infographics/news/hong-kong/article/3290257/helpers-bedtime-stories/index.html,https://multimedia.scmp.com/infographics/news/hong-kong/article/3267178/asylum-seekers/,https://multimedia.scmp.com/infographics/news/hong-kong/article/3250772/unauthorised-structures/index.html,https://multimedia.scmp.com/infographics/news/world/article/3292066/drone-shows/,https://multimedia.scmp.com/infographics/sport/article/3270445/olympics-games-2024/,https://multimedia.scmp.com/infographics/news/world/article/3252688/ukraine-war-two-years/index.html,,
Taiwan,天下雜誌,Small,Shortlist,,天下雜誌數位敘事團隊,天下雜誌是全台最大的訂閱制財經媒體，過去以特寫、文字報導，為讀者帶來深入的剖析。  但在四年前開始成立的數位敘事小組後，視覺化也成為天下報導的重要工具之一，特別是碰上重大新聞事件，資料和視覺圖表成為天下在報導上的獨家切角。  很多人會認為，天下作為legacy media，成立數位敘事小組自然會順水推舟、跟傳統報導一樣成功，但遠在台灣的legacy media，對於人才、組織資源的信任和取得，並不容易。  這次交出的作品集，也可以算是我們四年來的成品集，可以看到我們仍以深度長篇報導、解釋新聞為骨幹，但加入不同的最新的科技分析工具，例如衛星圖判別、3D建模、AI等，在報導之外，也同時兼顧創新工具的使用。  但台灣媒體不斷流失人才、喪失讀者信任之際，我們希望能在台灣證明，另一條報導方式的可能性，以及讓下個世代明瞭對newsroom可以有不同想像。,天下雜誌是全台最大的訂閱制財經媒體，過去以特寫、文字報導，為讀者帶來深入的剖析。  但在四年前開始成立的數位敘事小組後，視覺化也成為我們報導的重要工具之一，特別是碰上重大新聞事件，資料和視覺圖表成為天下在報導上的獨家切角。  在這份提交的作品集裡，主題涵蓋從2024年年初的AI輔助的台灣總統大選開票專輯、台海安全情勢、台灣25年來最大地震，到台灣能源轉型背後的綠電人權議題，我們期許在每一次關鍵事件，都透過資料、視覺專題報導，為讀者釐清複雜的新聞脈絡。  在技術上，我們也不斷嘗試全新的技術和工具，例如衛星圖判別、3D建模、AI等，在報導之外，也同時兼顧創新工具的使用。,中文,https://www.cw.com.tw/graphics/the-price-of-taiwan-energy-transition/index.html,https://www.cw.com.tw/graphics/2024-taiwan-elections/results-analysis/,https://www.cw.com.tw/graphics/2024-elections-temple-strategies/,https://www.cw.com.tw/graphics/taiwan-and-starlink/index.html,https://www.cw.com.tw/graphics/aftermath-of-hualien-earthquake-2024/,https://www.cw.com.tw/graphics/taiwan-alishan-spring-tea-on-the-verge/,https://www.cw.com.tw/graphics/taiwan-garbage-crisis-2024/,
