Ecuador,"Mongabay Latam, La Barra Espaciadora",Small,,,Ana Cristina Alvarado,"Creo que debo ser considerada para el Young Talent Prize porque mi interés por la intersección entre los derechos de la naturaleza y los derechos humanos me han llevado a investigar  la Amazonía ecuatoriana, una región compleja y diversa, pero que ha tenido poca cobertura periodística.  Soy periodista ambiental desde 2021. Pronto empecé a colaborar con Mongabay Latam, un medio de comunicación especializado en temas ambientales para Latinoamérica, y desde el 2024 me uní a este equipo como reportera senior.   El país ha sido concesionado en porcentajes importantes a las industrias mineras y petroleras. Estos proyectos no cuentan con la aprobación de los pueblos indígenas, provocando una serie de conflictos socioambientales. Las hidroeléctricas, la agroindustria y las carreteras también son amenazas vigentes.   Esta realidad ha dado pie a que en estos cuatro años realice múltiples investigaciones, reportajes y visitas a zonas alejadas y muchas veces peligrosas para conocer la magnitud de los impactos de las industrias extractivas y los efectos del ingreso de  las carreteras en lo profundo del bosque. Lo más importante, he accedido a testimonios de líderes indígenas y comuneros locales que dieron a conocer, en muchos casos por primera vez, lo que sucedía en sus territorios.   A través de mis investigaciones he comprobado que subsiste una visión colonizadora de los territorios amazónicos en los que se han priorizado intereses económicos y políticos sin tomar en cuenta procesos de consulta previa, libre e informada, para que los pobladores indígenas tomen decisiones plenas sobre su futuro.  En 2022, el especial Manchados por el petróleo fue finalista de los premios Fetisov y fue seleccionado entre las mejores investigaciones del Global investigative Journalism Network. En ese mismo año gané el Premio Nacional de Periodismo Jorge Mantilla Ortega por el especial Amazonía Viva, realizado junto al medio digital ecuatoriano La Barra Espaciadora.","Ecuador es, sin duda, uno de los países amazónicos más afectados por los impactos de la industria petrolera, la minería, el incremento de la deforestación y el tráfico ilegal de animales. Como periodista, uno de mis mayores objetivos ha sido probar la magnitud de estos problemas en territorios en los que existe poca información oficial. Las historias que forman parte de este portafolio se concentran en el impacto ambiental a ecosistemas sensibles, varios de los cuales son los más biodiversos del mundo, y la débil actuación de las autoridades nacionales.    En “La frontera agrícola crece: pitahaya causa deforestación en la Amazonía ecuatoriana” corroboré la tala de al menos 248 hectáreas de selva para el cultivo de esta fruta de exportación en zonas de conservación y áreas de importancia hídrica.   Al visitar el sitio afectado y hablar con sus autoridades encontré que el Municipio de Palora no tiene ordenanzas que sancionen este tipo de irregularidades. No solo eso, el Ministerio de Ambiente, que es la autoridad ambiental nacional, no dejó constancia de haber actuado ante la deforestación en zonas prohibidas. Lamentablemente, el cultivo de pitahaya ha seguido creciendo en esta y otras zonas del país.   En “Huellas en la arena: el tráfico de tortugas charapa en Ecuador”, realicé una extensa reportería en uno de los puntos más alejados de la Amazonía ecuatoriana para conocer el tráfico de tortugas charapa, uno de los animales más traficados del país y que también estarían siendo llevados ilegalmente a Perú para alimentar un millonario mercado negro de exportación de tortugas a Asia.   Lo sorprendente de esta historia fue revelar que la Policía Nacional de Ecuador y el Ministerio de Ambiente llevan registros diferentes de la fauna rescatada del tráfico. Por un lado, según la Policía, entre 2011 y 2020, 29771 animales fueron rescatados, unos 2977 por año. Por otro lado, según el Ministerio, entre 2019 y 2023, 15664 ejemplares fueron rescatados, unos 3132 por año.   Además, encontré que la Policía no identifica correctamente la especie rescatada, por ejemplo, puede enlistar una tortuga simplemente como tortuga, sin aclarar si es, por ejemplo, una Chelonoidis nigra, la tortuga gigante de Galápagos, o una Podocnemis unifilis, una de las más traficadas en Ecuador y Perú. Los expertos aseguran que sin datos fiables, no se puede diseñar estrategias de protección.  Finalmente, el portafolio incluye uno de los artículos que he realizado sobre la minería ilegal en Ecuador: ”Minería ilegal se expande en cuatro áreas protegidas de la Amazonía ecuatoriana”. He seguido este tema desde que explotó el caso de la provincia de Napo en 2022, revelando una gran expansión de esta actividad ilegal que está matando a varios ríos de esa provincia.   En la última entrega, realizada en octubre de 2024, cuento que la minería ilegal sumó 562 hectáreas afectadas dentro de cuatro áreas nacionales protegidas de la Amazonía. Además, conseguí testimonios que indican que disidencias de las Fuerzas Armadas Revolucionarias de Colombia y el grupo delictivo ecuatoriano los Lobos estarían controlando la actividad en esas zonas.",Español,https://es.mongabay.com/2024/01/frontera-agricola-crece-pitahaya-causa-deforestacion-en-amazonia-ecuatoriana/,https://es.mongabay.com/2024/08/huellas-en-la-arena-trafico-tortugas-charapa-ecuador/,https://es.mongabay.com/2024/10/mineria-ilegal-se-expande-areas-protegidas-amazonia-ecuatoriana/,https://es.mongabay.com/by/ana-cristina-alvarado/,https://es.mongabay.com/by/ana-cristina-alvarado-la-barra-espaciadora/,,,
Mexico,Al majalla Magazine,Small,,,Diana Estefanía Rubio,"Diana Estefanía Rubio – Application for [Award Name]  I am honored to submit my work for consideration, as I believe my experience in data visualization and information design showcases how art, communication, and storytelling through data can create impact. With over a decade of experience, I have dedicated my career to transforming complex datasets into insightful and engaging visual narratives.  Professional Background  Since 2010, I have worked as a freelance visual information designer, collaborating with CNN International, MacMillan Education, Turner International, Amnesty International, Wired en Español, and Al Majalla Magazine. My expertise extends to leadership roles, including: •Dataviz Coordinator at DatalabMX (2018-2021) – Bridging statistical analysis and journalism. •Head of Data Visualization at Afiniti (2021-2022) – Communicating AI-driven insights through visual storytelling. •Data Visualization Designer at Propelland (2024-Present) – Designing human-centered data visualizations.  Approach & Inspirations  I describe my work as “artisan data visualization”—a process where I analyze data and translate it into meaningful, emotionally resonant designs. I am deeply inspired by pioneers like Alberto Cairo, Giorgia Lupi, and Stefanie Posavec, who emphasize the human aspect of data. Their work has shaped my belief that data should be not only accurate but also engaging and accessible.  Working on bilingual projects in English and Arabic, I have developed a culturally adaptable approach, ensuring that typography, colors, and reading direction enhance accessibility and inclusivity in diverse audiences.  Commitment to Education  I also teach data visualization at: •Centro (2019-2022) – Instructor in the Data Visualization Specialization Program. •Domestika (2021-Present) – Course creator: “Data Visualization for Editorial Projects”. •Tecnológico de Monterrey (2022-Present) – Educator in People Analytics.  I believe data visualization can drive change, bridging numbers, human experiences, and social issues. This award would be an opportunity to further push the boundaries of data storytelling, inspire global conversations, and continue developing visual narratives that make data more human.","The projects presented were created for Al Majalla Magazine, where I serve as an information designer, developing data visualization projects for both print and digital editions in English and Arabic. This role has been an exciting challenge, pushing me to refine my design approach, cross-cultural adaptability, and technical skills.  One of the biggest challenges has been working in two languages with distinct scripts and reading directions. Arabic and English not only have different typographic structures and gliph systems, but they also require a fundamentally different approach to layout and visual composition. Arabic is read from right to left, while English follows a left-to-right orientation. This means that every chart, infographic, and typographic element must be carefully adapted to ensure that both audiences experience a seamless and intuitive reading flow.  Beyond typography, cultural nuances also play a significant role. Certain colors, symbols, and visual metaphors that may be intuitive to Western audiences do not always translate effectively for readers in the Middle East. This has led me to develop a more thoughtful, research-driven approach to design. Each project requires a deep understanding of the subject matter, the target audience, and the way information is perceived differently across cultures.  Working on Al Majalla Magazine has been an incredible professional growth opportunity, allowing me to bridge Western and Middle Eastern visual communication styles. It has reinforced the importance of adaptability—not only in terms of language and layout but also in how data is presented and interpreted. In the world of data visualization, numbers alone do not tell a story; how they are structured, designed, and contextualized determines their impact.  From a technical perspective, my role involves using Adobe Illustrator for infographic design, Microsoft Excel for data processing, and Adobe Photoshop for integrating artistic elements when necessary. These tools allow me to create precise, high-impact visuals that translate complex information into clear and engaging narratives. At times, I collaborate with illustrators and editorial teams to ensure that every visualization complements the magazine’s storytelling goals, adding an extra layer of depth to each project.  One of the most rewarding aspects of this experience has been seeing how data visualization can transcend linguistic and cultural barriers. A well-designed infographic should be universally understandable, no matter the reader’s native language or background. This has led me to explore innovative techniques to make charts, diagrams, and data stories more intuitive and visually compelling across diverse audiences.  Working on projects that reach both European and Middle Eastern readers has broadened my perspective as a designer. It has challenged me to think beyond Western-centric approaches and develop a more global design mindset. The ability to communicate complex data effectively, regardless of language or cultural background, is an invaluable skill I will carry forward in my career.  Ultimately, my work with Al Majalla Magazine has not only refined my technical and creative abilities but has also strengthened my passion for information design as a bridge between cultures  as well as my return to the publishing world.",English and Arab,https://drive.google.com/file/d/1eYsS-Gq0VnJ77sMYnnM4xhHIJJfDJdW2/view?usp=sharing,https://drive.google.com/file/d/1PM4eLTABV2MhhGeL4pG3napjiRcuMcXL/view?usp=drive_link,https://drive.google.com/file/d/17DVwE7H2muF9r5YCUllWtqeq0XBEna7C/view?usp=drive_link,https://drive.google.com/file/d/1xpBqe7cVDDzNq62cFYTm0rP6RXXeFRvh/view?usp=drive_link,https://drive.google.com/file/d/14CUwC8JTILt8l80NjQqVaOaLvNPSH9Zu/view?usp=drive_link,https://drive.google.com/file/d/1cSWDsSof7QAyk49g8hN7YQ6ED1E-8SjA/view?usp=drive_link,,
Brazil,Organização: Site Avoador; Responsável pela publicação: Rafaella Leite (Bolsista).,Small,,,Rafaella Leite,"Como estudante de jornalismo e bolsista do projeto de extensão “O Futuro do Jornalismo é Local” há um ano e meio, produzi reportagens investigativas que aprofundam debates sociais, especialmente sobre questões de gênero, estereótipos e a promoção da saúde voltada ao público feminino. Ao longo desse período, a participação ativa na confecção desses materiais transformou não apenas minha visão sobre o ofício, mas também a forma como enfrento os desafios e as responsabilidades de contar histórias que impactam tanto a vida das pessoas quanto a minha.  Esses trabalhos, pelos quais estou me inscrevendo, foram selecionados devido à profundidade da apuração e à contribuição social de sua divulgação. Eles refletem meu compromisso com um jornalismo que vai além da simples informação, questionando e gerando reflexões sobre as questões estruturais da sociedade, sempre com o objetivo de promover transparência e humanização.  Acredito que essa premiação na categoria jovem talento pode servir como incentivo para outras iniciativas sem fins lucrativos, estimulando a produção e o compartilhamento de informações e notícias de qualidade e responsabilidade. Embora esses trabalhos tenham sido realizados sem qualquer tipo de patrocínio ou recursos financeiros de terceiros, eles são oferecidos à população de forma gratuita e confiável, demonstrando a necessidade de um jornalismo comprometido com a verdade e a transformação social. Por isso, acredito que merecem ser reconhecidos por desenvolverem iniciativas investigativas com relevância local.","Este portfólio reúne reportagens sobre desigualdade de gênero e acesso a direitos essenciais, com foco nas vivências femininas na cidade de Vitória da Conquista. Com apuração rigorosa, checagem de fatos e escuta atenta e ética das fontes, busco produzir conteúdos que informem e provoquem reflexões sobre realidades frequentemente invisibilizadas.  Na editoria Maria Maria, do Site Avoador investiguei através da reportagem ”Transporte público de Conquista tem apenas 6 mulheres motoristas”, a baixa presença feminina no setor de mobilidade urbana e os desafios para ingressar e se manter na profissão, desde a resistência a preconceitos e assédios  no ambiente de trabalho a falta de políticas de incentivo. Já com a reportagem ”Câncer de mama: informação e acesso a exames salvam vidas”, destaquei a importância do diagnóstico precoce e do acesso a exames preventivos, trazendo dados locais e relatos de mulheres que enfrentaram dificuldades para obter atendimento.  Já na editoria Página central apresentei com a matéria ”Mais de 1,5 mil pessoas esperam um transplante de córnea em Conquista”, um panorama da fila de espera, os impactos na qualidade de vida dos pacientes e os desafios do sistema público de saúde no processo de doação órgãos, incentivando a conscientização.   Todos os trabalhos são de autoria única e contam com a revisão textual da editora-chefe do site. A produção dos conteúdos envolve a estruturação da reportagem, pesquisa e checagem de dados em repositórios públicos, entrevistas de campo e online com dez pessoas (8 mulheres e 2 homens), fotografia de campo, coleta de arquivos pessoais e pesquisa de imagens ilustrativas em repositórios.  Além disso, inclui a produção de cards de divulgação, com o objetivo de criar narrativas que equilibram objetividade e profundidade jornalística, sem perder a humanização das histórias.  Entre os principais desafios, destacam-se a checagem de informações atualizadas, o retorno das entrevistas, o enfrentamento de comentários preconceituosos em uma visita de campo e a necessidade de percorrer grande parte do trajeto a pé devido à falta de orçamento. Os obstáculos foram superados por meio da organização de rotinas de verificação, da utilização de ferramentas digitais para monitorar os dados e do estabelecimento de follow-ups, aliados à persistência, ética e tranquilidade.   O impacto dessas matérias pode ser medido pelo engajamento do público nas plataformas do Avoador e pela repercussão dos temas abordados. A matéria sobre motoristas mulheres, por exemplo, gerou debates sobre a inclusão feminina no setor e obteve 4.662 visualizações no Instagram. A reportagem sobre câncer de mama teve 3.448 visualizações, com 59,3% delas vindas de não seguidores do perfil oficial do site. Já a matéria sobre transplantes contribuiu para a conscientização sobre a importância da doação de órgãos, com 1.617 visualizações e o alcance de 852 novas contas.",Português.,https://avoador.com.br/maria-maria/transporte-publico-de-conquista-tem-apenas-6-mulheres-motoristas/,https://avoador.com.br/maria-maria/cancer-de-mama-informacao-e-acesso-a-exames-salvam-vidas/,https://avoador.com.br/pagina-central/mais-15-mil-pessoas-esperam-um-transplante-de-cornea-em-conquista/,,,,,
Chile,Mongabay Latam,Small,,,Michelle Carrere,"Soy periodista y editora en Mongabay Latam desde hace siete años, donde lidero la cobertura sobre temas de océanos en América Latina. Cuando empecé, los temas ambientales tenían poca cabida en la agenda de los medios tradicionales y las historias de océanos estaban particularmente invisibilizadas. Mi trabajo ha contribuido a que eso cambie.   Partimos investigando temas que podían abordarse desde la costa, pero entendimos rápidamente que las grandes historias estaban mar adentro. ¿Cómo podíamos saber lo que ocurría en el océano abierto?   Nos contactamos con científicos que estaban analizando datos satelitales de las embarcaciones para saber cuáles eran sus trayectorias y dónde estaban pescando. Hasta ese momento, el periodismo nunca había utilizado esas herramientas para investigar lo que pasaba en el mar. Eso cambió cuando publicamos “Mares Saqueados”, una investigación sobre pesca ilegal en áreas marinas protegidas de cuatro países. La serie utilizó por primera vez datos satelitales para detectar casos que luego fueron contrastados con información oficial. La investigación fue elegida entre las mejores de América Latina por la GIJN.  Luego cubrimos el avance de las flotas chinas en América del Sur, el tráfico de especies marinas y su vinculación con el crimen organizado, así como los impactos del cambio climático en los océanos. Eso sin descuidar las decenas de historias que narran los esfuerzos y avances de comunidades locales, indígenas y académicas para la conservación de diversos ecosistemas marinos.   Además, para fomentar la cobertura de temas de océanos en otros medios, he realizado diversos talleres en la región. En 2024, formamos a más de 10 periodistas mexicanos y este año formaremos a 30.   En 2023 gané el premio a mejor crónica de la Sociedad Interamericana de Prensa y el Pulitzer Center me ubicó entre las mejores periodistas en un informe sobre la cobertura global de temas de océanos.","Desde 2018 lideró la cobertura de Mongabay Latam sobre océanos en América Latina, un tema que sigue siendo de los menos reportados en el sector ambiental. Cubrimos historias desde México hasta Chile y, a lo largo de estos años, hemos innovado en los métodos para investigar historias marinas, usando información satelital, bases de datos e inteligencia artificial para descubrir desde patrones de pesca ilegal hasta derrames de petróleo en mar abierto. También hemos desarrollado esfuerzos colaborativos y transnacionales para entender la magnitud, por ejemplo, del tráfico de especies y su relación con el crimen organizado. En este portafolio destaco cuatro trabajos.    En #MaresSaqueados utilizamos información satelital e inteligencia artificial para detectar patrones de pesca ilegal después de revisar los movimientos de cientos de barcos que se desplazaron al interior y al límite de cuatro reservas marinas: Revillagigedo en México, Yurupari Malpelo en Colombia, Galápagos en Ecuador y Nazca Desventuradas en Chile. A la par, realizamos decenas de solicitudes de información para conocer la presencia y trayecto de estas embarcaciones. La información fue sistematizada, analizada y corroborada por científicos y expertos.  Descubrimos que algunos de los barcos y compañías pesqueras identificadas tenían ya antecedentes criminales.   Desde 2020, también empezamos a investigar con detalle a las flota chinas, un grupo de más de 300 embarcaciones que llegan a Latinoamérica a pescar bajo prácticas de insustentabilidad pesquera e, incluso en algunos casos, de trabajo forzado. Una de las principales historias  reveló que bajo la bandera panameña operan embarcaciones asociadas a una de las empresas chinas con el mayor registro criminal en asuntos pesqueros de todo el mundo. Por primera vez — y mediante una reportería exhaustiva en la que se crearon bases de datos y se rastrearon barcos utilizando tecnología satelital — una investigación periodística abordó la problemática de las banderas de conveniencia y reveló la participación de Panamá en las operaciones de la flota china. Durante estos años, hemos hecho 25 reportajes sobre las operaciones de esta flota en la región.   En 2023, en alianza con OCCRP, rastreamos la ruta a través de la cual se movilizó el mayor cargamento de aletas de tiburón que Colombia ha decomisado y revelamos que el propietario era Fernando Rodríguez Mondragón, hijo de Gilberto Rodríguez Orejuela, gran jefe del cartel de Cali. Poco tiempo después de publicado el reportaje, el empresario fue detenido por las autoridades.   Finalmente, en una serie de cinco reportajes realizados en cinco países de América Latina abordamos en el 2024 la problemática de miles de personas desplazadas y cuyas comunidades han sido destruidas por las olas debido al aumento del nivel del mar en la región.   El problema de fondo se repite: la falta de información debido a la nula disponibilidad de presupuesto para desarrollar investigación científica, sumado a la inacción de las autoridades y las decisiones a corto plazo que solo empeoran el panorama a futuro.",Español,https://es.mongabay.com/by/michelle-carrere/,https://es.mongabay.com/2024/03/chile-formula-de-minera-quiborax-para-saltarse-reglas-en-salar-de-surire/,https://es.mongabay.com/2024/08/comunidades-bajo-el-agua-crecida-del-mar-amenaza-con-desaparecer-tierras-costeras-del-mapa/,https://es.mongabay.com/2024/09/mecanismo-acaba-con-pescadores-artesanales-sur-de-chile/,https://pulitzercenter.org/sites/default/files/2024-10/MakingWaves.pdf,,,
